IP 127.0.0.1.45728 > 127.0.0.1.54321: Flags [S], seq 2594781838, win 65495, options [mss 65495,sackOK,TS val 2644154728 ecr 0,nop,wscale 7], length 0
E..<..@.@..............1..:..........0.........
...h........
IP 127.0.0.1.54321 > 127.0.0.1.45728: Flags [S.], seq 1190927659, ack 2594781839, win 65483, options [mss 65495,sackOK,TS val 2644154728 ecr 2644154728,nop,wscale 7], length 0
E..<..@.@.<..........1..F..+..:......0.........
...h...h....
IP 127.0.0.1.45728 > 127.0.0.1.54321: Flags [.], ack 1, win 512, options [nop,nop,TS val 2644154728 ecr 2644154728], length 0
E..4..@.@..............1..:.F..,.....(.....
...h...h
IP 127.0.0.1.45728 > 127.0.0.1.54321: Flags [P.], seq 1:15, ack 1, win 512, options [nop,nop,TS val 2644364751 ecr 2644154728], length 14
E..B..@.@..............1..:.F..,.....6.....
.......hHello, World!

IP 127.0.0.1.54321 > 127.0.0.1.45728: Flags [.], ack 15, win 512, options [nop,nop,TS val 2644364751 ecr 2644364751], length 0
E..4.h@.@.hY.........1..F..,..:......(.....
........
IP 127.0.0.1.54321 > 127.0.0.1.45728: Flags [F.], seq 1, ack 15, win 512, options [nop,nop,TS val 2644474608 ecr 2644364751], length 0
E..4.i@.@.hX.........1..F..,..:......(.....
..z.....
IP 127.0.0.1.45728 > 127.0.0.1.54321: Flags [.], ack 2, win 512, options [nop,nop,TS val 2644474609 ecr 2644474608], length 0
E..4..@.@..............1..:.F..-.....(.....
..z...z.
IP 127.0.0.1.45728 > 127.0.0.1.54321: Flags [F.], seq 15, ack 2, win 512, options [nop,nop,TS val 2644476375 ecr 2644474608], length 0
E..4..@.@..............1..:.F..-.....(.....
......z.
IP 127.0.0.1.54321 > 127.0.0.1.45728: Flags [.], ack 16, win 512, options [nop,nop,TS val 2644476375 ecr 2644476375], length 0
E..4..@.@.<..........1..F..-..:.....w......
........
